<?xml version="1.0" encoding="UTF-8" ?>
<!DOCTYPE traps SYSTEM "./trap.dtd">
<!--
-->
<traps>
    <default>
        <port>162</port>
        <socket_type type="STD"/>
    </default>
    <test>
        <version no="1"/>
        <host>roke</host>
        <port>161</port>
        <socket_type type="STD"/>
        <community>public</community>
    </test>
    <test>
        <version no="1"/>
        <host>selidor</host>
        <port>161</port>
        <socket_type type="STD"/>
        <community>public</community>
    </test>
    <test>
        <version no="2c"/>
        <host>selidor</host>
        <port>161</port>
        <socket_type type="STD"/>
        <community>public</community>
    </test>
    <test>
        <version no="1"/>
        <host>way</host>
        <port>161</port>
        <socket_type type="STD"/>
        <community>public</community>
    </test>
    <test>
        <version no="2c"/>
        <host>way</host>
        <port>161</port>
        <socket_type type="STD"/>
        <community>public</community>
    </test>
    <test>
        <version no="3"/>
        <host>way</host>
        <port>161</port>
        <socket_type type="STD"/>
        <usm>
            <username>noAuthUser</username>
            <context>
                <id></id>
                <name>public</name>
            </context>
            <auth ado="no"></auth>
        </usm>
    </test>
    <test>
        <version no="3"/>
        <host>way</host>
        <port>161</port>
        <socket_type type="STD"/>
        <usm>
            <username>authUser</username>
            <context>
                <id></id>
                <name>public</name>
            </context>
            <auth ado="yes">
                <aproto>MD5</aproto>
                <apassw>AuthPassword</apassw>
            </auth>
            <priv pdo="no"></priv>
        </usm>
    </test>
    <test>
        <version no="3"/>
        <host>way</host>
        <port>161</port>
        <socket_type type="STD"/>
        <usm>
            <username>privUser</username>
            <context>
                <id></id>
                <name>public</name>
            </context>
            <auth ado="yes">
                <aproto>MD5</aproto>
                <apassw>AuthPassword</apassw>
            </auth>
            <priv pdo="yes">
                <ppassw>PrivPassword</ppassw>
            </priv>
        </usm>
    </test>
    <test>
        <version no="3"/>
        <host>way</host>
        <port>161</port>
        <socket_type type="STD"/>
        <usm>
            <username>authSHAUser</username>
            <context>
                <id></id>
                <name>public</name>
            </context>
            <auth ado="yes">
                <aproto>SHA1</aproto>
                <apassw>AuthPassword</apassw>
            </auth>
            <priv pdo="no"></priv>
        </usm>
    </test>
    <test>
        <version no="3"/>
        <host>way</host>
        <port>161</port>
        <socket_type type="STD"/>
        <usm>
            <username>privSHAUser</username>
            <context>
                <id></id>
                <name>public</name>
            </context>
            <auth ado="yes">
                <aproto>SHA1</aproto>
                <apassw>AuthPassword</apassw>
            </auth>
            <priv pdo="yes">
                <ppassw>PrivPassword</ppassw>
            </priv>
        </usm>
    </test>
</traps>
